{
  "$schema": "http://json-schema.org/draft-07/schema#",
  "$id": "https://evolith.dev/rulesets/schema/ruleset-standard.schema.json",
  "title": "Standard Ruleset Schema",
  "type": "object",
  "properties": {
    "$schema": { "type": "string" },
    "$id": { "type": "string", "format": "uri" },
    "title": { "type": "string" },
    "description": { "type": "string" },
    "version": { "type": "string" },
    "effectiveDate": { "type": "string", "format": "date" },
    "adrId": { "type": "string" },
    "adrTitle": { "type": "string" },
    "status": { "type": "string" },
    "date": { "type": "string" },
    "exitCriteria": {
      "type": "object"
    },
    "references": {
      "type": "array",
      "items": { "type": "string" }
    },
    "rules": {
      "type": "array",
      "items": {
        "$ref": "#/definitions/rule"
      }
    },
    "principles": {
      "type": "array",
      "items": {
        "$ref": "#/definitions/rule"
      }
    }
  },
  "anyOf": [
    { "required": ["rules"] },
    { "required": ["principles"] }
  ],
  "definitions": {
    "rule": {
      "type": "object",
      "properties": {
        "id": { "type": "string" },
        "severity": { "type": "string" },
        "category": { "type": "string" },
        "title": { "type": "string" },
        "principle": { "type": "string" },
        "description": { "type": "string" },
        "statement": { "type": "string" },
        "rationale": { "type": "string" },
        "validationQuery": { "type": "string" },
        "blocking": { "type": "boolean" },
        "enforcement": { "type": "string" },
        "layer": { "type": "string" },
        "examples": {
          "type": "array",
          "items": { "type": "string" }
        },
        "structure": {
          "type": "array",
          "items": { "type": "string" }
        }
      },
      "anyOf": [
        { "required": ["id", "title", "description"] },
        { "required": ["id", "principle", "statement"] },
        { "required": ["title", "description"] }
      ]
    }
  }
}
