{
  "$schema": "../../schema/ruleset-standard.schema.json",
  "$id": "https://evolith.dev/rulesets/adr/generated/adr-0013-cloud-infrastructure-topology-and-disaster-recovery-dr.rules.json",
  "title": "ADR-0013 — Cloud Infrastructure Topology and Disaster Recovery (DR) Rules (generated)",
  "description": "Auto-generated ruleset encoding ADR-0013 (core track). Classification: advisory. Generated by .harness/scripts/generate-adr-rulesets.mjs — do not edit by hand.",
  "version": "1.0.0",
  "adrId": "ADR-0013",
  "adrTitle": "Cloud Infrastructure Topology and Disaster Recovery (DR)",
  "status": "Approved",
  "date": "2026-05-08",
  "rules": [
    {
      "id": "CORE-0013-01",
      "severity": "SHOULD",
      "category": "adr-conformance",
      "title": "Honor design decision in ADR-0013: Cloud Infrastructure Topology and Disaster Recovery (DR)",
      "description": "Design and implementation SHOULD honor the decision recorded in ADR-0013 (core track). ADR decision: Design infrastructure topology targeting Cloud Native patterns enforcing high resilience and instant failover potential: 1. Automated Orchestration : Deployment evolves by architectural phase. Manual attestation required — not machine-verifiable.",
      "statement": "ADR decision: Design infrastructure topology targeting Cloud Native patterns enforcing high resilience and instant failover potential: 1. Automated Orchestration : Deployment evolves by architectural phase.",
      "rationale": "Derived from ADR-0013 \"Decision\" section. No machine-verifiable signals detected; treated as an advisory design decision.",
      "blocking": false,
      "enforcement": "advisory"
    }
  ],
  "references": [
    "reference/architecture/adrs/core/0013-cloud-infrastructure-topology-dr.md"
  ],
  "effectiveDate": "2026-05-08"
}
