{
  "$schema": "../../schema/ruleset-standard.schema.json",
  "$id": "https://evolith.dev/rulesets/adr/generated/adr-dotnet-0061-transactional-event-lifecycle-in-ef-core.rules.json",
  "title": "ADR-0061 — Transactional Event Lifecycle in EF Core Rules (generated)",
  "description": "Auto-generated ruleset encoding ADR-0061 (dotnet track). Classification: advisory. Generated by .harness/scripts/generate-adr-rulesets.mjs — do not edit by hand.",
  "version": "1.0.0",
  "adrId": "ADR-0061",
  "adrTitle": "Transactional Event Lifecycle in EF Core",
  "status": "Proposed",
  "date": "2026-05-23",
  "rules": [
    {
      "id": "DOT-0061-01",
      "severity": "SHOULD",
      "category": "adr-conformance",
      "title": "Honor design decision in ADR-0061: Transactional Event Lifecycle in EF Core",
      "description": "Design and implementation SHOULD honor the decision recorded in ADR-0061 (dotnet track). ADR decision: We standardize a strict Post Commit Event Clearing sequence for all SQL repositories using EF Core: 1. Map and Track : The repository maps aggregate domain events to OutboxMessages and registers them with the EF DbContext change tracker. Manual attestation required — not machine-verifiable.",
      "statement": "ADR decision: We standardize a strict Post Commit Event Clearing sequence for all SQL repositories using EF Core: 1. Map and Track : The repository maps aggregate domain events to OutboxMessages and registers them with the EF DbContext change tracker.",
      "rationale": "Derived from ADR-0061 \"Decision\" section. No machine-verifiable signals detected; treated as an advisory design decision.",
      "blocking": false,
      "enforcement": "advisory"
    }
  ],
  "references": [
    "reference/architecture/adrs/dotnet/0061-transactional-event-lifecycle-ef-core.md"
  ],
  "effectiveDate": "2026-05-23"
}
