{
  "$schema": "../../schema/ruleset-standard.schema.json",
  "$id": "https://evolith.dev/rulesets/adr/generated/adr-0024-centralized-configuration-feature-platform.rules.json",
  "title": "ADR-0024 — Centralized Configuration & Feature Platform Rules (generated)",
  "description": "Auto-generated ruleset encoding ADR-0024 (core track). Classification: advisory. Generated by .harness/scripts/generate-adr-rulesets.mjs — do not edit by hand.",
  "version": "1.0.0",
  "adrId": "ADR-0024",
  "adrTitle": "Centralized Configuration & Feature Platform",
  "status": "Approved",
  "date": "2026-05-09",
  "rules": [
    {
      "id": "CORE-0024-01",
      "severity": "SHOULD",
      "category": "adr-conformance",
      "title": "Honor design decision in ADR-0024: Centralized Configuration & Feature Platform",
      "description": "Design and implementation SHOULD honor the decision recorded in ADR-0024 (core track). ADR decision: Introduce an authoritative Configuration & Feature Management Bounded Context consolidating system behaviors: 1. Dynamic IdP Store : Shift identity configurations out of environment files into multi tenant database pools, encrypted with AES 256 referencing external secret vaults. Manual attestation required — not machine-verifiable.",
      "statement": "ADR decision: Introduce an authoritative Configuration & Feature Management Bounded Context consolidating system behaviors: 1. Dynamic IdP Store : Shift identity configurations out of environment files into multi tenant database pools, encrypted with AES 256 referencing external secret vaults.",
      "rationale": "Derived from ADR-0024 \"Decision\" section. No machine-verifiable signals detected; treated as an advisory design decision.",
      "blocking": false,
      "enforcement": "advisory"
    }
  ],
  "references": [
    "reference/architecture/adrs/core/0024-configuration-feature-management-platform.md"
  ],
  "effectiveDate": "2026-05-09"
}
