{
  "$schema": "../../schema/ruleset-standard.schema.json",
  "$id": "https://evolith.dev/rulesets/adr/generated/adr-0028-self-hosted-open-source-hybrid-infrastructure.rules.json",
  "title": "ADR-0028 — Self-Hosted, Open-Source Hybrid Infrastructure Rules (generated)",
  "description": "Auto-generated ruleset encoding ADR-0028 (core track). Classification: executable. Generated by .harness/scripts/generate-adr-rulesets.mjs — do not edit by hand.",
  "version": "1.0.0",
  "adrId": "ADR-0028",
  "adrTitle": "Self-Hosted, Open-Source Hybrid Infrastructure",
  "status": "Approved",
  "date": "2026-05-09",
  "rules": [
    {
      "id": "CORE-0028-01",
      "severity": "MUST",
      "category": "adr-conformance",
      "title": "Conform to ADR-0028: Self-Hosted, Open-Source Hybrid Infrastructure",
      "description": "Implementations MUST conform to the decision recorded in ADR-0028 (core track). ADR decision: Strictly govern internal tooling selection based on the 100% Open Source, Self Hostable, and Plug and Play Extensibility Principle : 1. Infrastructure as a Port : NO concrete infrastructure SDK/Library from the products listed below may ever cross into Domain/Application layers. This ADR contains enforceable language (must, layer, structure); conformance is expected to be verifiable via static analysis, linting, CI gates, or structural checks.",
      "statement": "ADR decision: Strictly govern internal tooling selection based on the 100% Open Source, Self Hostable, and Plug and Play Extensibility Principle : 1. Infrastructure as a Port : NO concrete infrastructure SDK/Library from the products listed below may ever cross into Domain/Application layers.",
      "rationale": "Derived from ADR-0028 \"Decision\" section. Enforcement signals detected: must, layer, structure.",
      "validationQuery": "Verify codebase/CI compliance with ADR-0028 via static analysis, lint rules, or pipeline gates covering: must, layer, structure. Concrete checks to be wired into the harness.",
      "blocking": true,
      "enforcement": "executable"
    }
  ],
  "references": [
    "reference/architecture/adrs/core/0028-self-hosted-hybrid-infrastructure-on-premise.md"
  ],
  "effectiveDate": "2026-05-09"
}
