{
  "$schema": "../../../../../rulesets/schema/ruleset-standard.schema.json",
  "$id": "https://evolith.dev/rulesets/topologies/data-mesh.rules.json",
  "title": "Data Mesh Topology Rules",
  "description": "Architectural rules for the Data Mesh topology.",
  "version": "1.0.0",
  "effectiveDate": "2026-06-20",
  "rules": [
    {
      "id": "DAM-R01",
      "severity": "MUST",
      "category": "data-mesh-config",
      "title": "Data Product Designation",
      "description": "A Data Mesh satellite MUST provide data-mesh.config.json and declare isDataProduct=true.",
      "blocking": true
    },
    {
      "id": "DAM-R02",
      "severity": "MUST",
      "category": "data-mesh-contracts",
      "title": "Data Contracts",
      "description": "data-mesh.config.json MUST declare hasDataContracts=true.",
      "blocking": true
    },
    {
      "id": "DAM-R03",
      "severity": "MUST",
      "category": "data-mesh-governance",
      "title": "Federated Governance",
      "description": "data-mesh.config.json MUST declare federatedGovernance=true.",
      "blocking": true
    }
  ]
}
