{
  "$schema": "../../schema/ruleset-standard.schema.json",
  "$id": "https://evolith.dev/rulesets/adr/generated/adr-android-0042-canonical-android-native-mobile-architecture.rules.json",
  "title": "ADR-0042 — Canonical Android Native Mobile Architecture Rules (generated)",
  "description": "Auto-generated ruleset encoding ADR-0042 (android track). Classification: executable. Generated by .harness/scripts/generate-adr-rulesets.mjs — do not edit by hand.",
  "version": "1.0.0",
  "adrId": "ADR-0042",
  "adrTitle": "Canonical Android Native Mobile Architecture",
  "status": "Approved",
  "date": "2026-05-11",
  "rules": [
    {
      "id": "AND-0042-01",
      "severity": "MUST",
      "category": "adr-conformance",
      "title": "Conform to ADR-0042: Canonical Android Native Mobile Architecture",
      "description": "Implementations MUST conform to the decision recorded in ADR-0042 (android track). ADR decision: The canonical Android stack consists of: Language : 100% Kotlin (Modern coroutines for async execution). UI Engine : Jetpack Compose (Declarative, reactive UI mapping state directly). This ADR contains enforceable language (must, dependency, dependencies); conformance is expected to be verifiable via static analysis, linting, CI gates, or structural checks.",
      "statement": "ADR decision: The canonical Android stack consists of: Language : 100% Kotlin (Modern coroutines for async execution). UI Engine : Jetpack Compose (Declarative, reactive UI mapping state directly).",
      "rationale": "Derived from ADR-0042 \"Decision\" section. Enforcement signals detected: must, dependency, dependencies.",
      "validationQuery": "Verify codebase/CI compliance with ADR-0042 via static analysis, lint rules, or pipeline gates covering: must, dependency, dependencies. Concrete checks to be wired into the harness.",
      "blocking": true,
      "enforcement": "executable"
    }
  ],
  "references": [
    "reference/architecture/adrs/android/0042-canonical-android-mobile-architecture.md"
  ],
  "effectiveDate": "2026-05-11"
}
