{
  "$schema": "../../schema/ruleset-standard.schema.json",
  "$id": "https://evolith.dev/rulesets/adr/generated/adr-0034-cqrs-pattern-application-matrix.rules.json",
  "title": "ADR-0034 — CQRS Pattern Application Matrix Rules (generated)",
  "description": "Auto-generated ruleset encoding ADR-0034 (core track). Classification: executable. Generated by .harness/scripts/generate-adr-rulesets.mjs — do not edit by hand.",
  "version": "1.0.0",
  "adrId": "ADR-0034",
  "adrTitle": "CQRS Pattern Application Matrix",
  "status": "Approved",
  "date": "2026-05-11",
  "rules": [
    {
      "id": "CORE-0034-01",
      "severity": "MUST",
      "category": "adr-conformance",
      "title": "Conform to ADR-0034: CQRS Pattern Application Matrix",
      "description": "Implementations MUST conform to the decision recorded in ADR-0034 (core track). ADR decision: Adopt the following Evaluation Matrix to determine if a specific Use Case requires Full CQRS enforcement: Criteria : Basic CRUD operations, simple state changes, low to medium concurrent access. This ADR contains enforceable language (must, required, enforce); conformance is expected to be verifiable via static analysis, linting, CI gates, or structural checks.",
      "statement": "ADR decision: Adopt the following Evaluation Matrix to determine if a specific Use Case requires Full CQRS enforcement: Criteria : Basic CRUD operations, simple state changes, low to medium concurrent access.",
      "rationale": "Derived from ADR-0034 \"Decision\" section. Enforcement signals detected: must, required, enforce.",
      "validationQuery": "Verify codebase/CI compliance with ADR-0034 via static analysis, lint rules, or pipeline gates covering: must, required, enforce. Concrete checks to be wired into the harness.",
      "blocking": true,
      "enforcement": "executable"
    }
  ],
  "references": [
    "reference/architecture/adrs/core/0034-cqrs-pattern-applicability-matrix.md"
  ],
  "effectiveDate": "2026-05-11"
}
