{
  "$schema": "../../schema/ruleset-standard.schema.json",
  "$id": "https://evolith.dev/rulesets/adr/generated/adr-nodejs-0012-advanced-authorization-rbac-abac-strategy.rules.json",
  "title": "ADR-0012 — Advanced Authorization (RBAC/ABAC) Strategy Rules (generated)",
  "description": "Auto-generated ruleset encoding ADR-0012 (nodejs track). Classification: advisory. Generated by .harness/scripts/generate-adr-rulesets.mjs — do not edit by hand.",
  "version": "1.0.0",
  "adrId": "ADR-0012",
  "adrTitle": "Advanced Authorization (RBAC/ABAC) Strategy",
  "status": "Approved",
  "date": "2026-05-08",
  "rules": [
    {
      "id": "NODE-0012-01",
      "severity": "SHOULD",
      "category": "adr-conformance",
      "title": "Honor design decision in ADR-0012: Advanced Authorization (RBAC/ABAC) Strategy",
      "description": "Design and implementation SHOULD honor the decision recorded in ADR-0012 (nodejs track). ADR decision: Implement a Hybrid Architecture bridging Role Based (RBAC) and Attribute Based (ABAC) access control: 1. NestJS Guard Framework : Deploy custom @Roles() and @Permissions() annotations on controllers. Manual attestation required — not machine-verifiable.",
      "statement": "ADR decision: Implement a Hybrid Architecture bridging Role Based (RBAC) and Attribute Based (ABAC) access control: 1. NestJS Guard Framework : Deploy custom @Roles() and @Permissions() annotations on controllers.",
      "rationale": "Derived from ADR-0012 \"Decision\" section. No machine-verifiable signals detected; treated as an advisory design decision.",
      "blocking": false,
      "enforcement": "advisory"
    }
  ],
  "references": [
    "reference/architecture/adrs/nodejs/0012-advanced-authorization-rbac-abac.md"
  ],
  "effectiveDate": "2026-05-08"
}
