{
  "$schema": "../../schema/ruleset-standard.schema.json",
  "$id": "https://evolith.dev/rulesets/adr/generated/adr-nodejs-0046-prohibition-of-raw-technical-identifiers-in-user-interfaces.rules.json",
  "title": "ADR-0046 — Prohibition of Raw Technical Identifiers in User Interfaces Rules (generated)",
  "description": "Auto-generated ruleset encoding ADR-0046 (nodejs track). Classification: executable. Generated by .harness/scripts/generate-adr-rulesets.mjs — do not edit by hand.",
  "version": "1.0.0",
  "adrId": "ADR-0046",
  "adrTitle": "Prohibition of Raw Technical Identifiers in User Interfaces",
  "status": "Accepted",
  "date": "2026-06-07",
  "rules": [
    {
      "id": "NODE-0046-01",
      "severity": "MUST",
      "category": "adr-conformance",
      "title": "Conform to ADR-0046: Prohibition of Raw Technical Identifiers in User Interfaces",
      "description": "Implementations MUST conform to the decision recorded in ADR-0046 (nodejs track). ADR decision: Raw technical identifiers (UUIDs, GUIDs, surrogate keys, internal database IDs) must never be rendered directly in a user facing interface unless a specific, justified business requirement explicitly requires it. This ADR contains enforceable language (must, layer, enforce); conformance is expected to be verifiable via static analysis, linting, CI gates, or structural checks.",
      "statement": "ADR decision: Raw technical identifiers (UUIDs, GUIDs, surrogate keys, internal database IDs) must never be rendered directly in a user facing interface unless a specific, justified business requirement explicitly requires it.",
      "rationale": "Derived from ADR-0046 \"Decision\" section. Enforcement signals detected: must, layer, enforce.",
      "validationQuery": "Verify codebase/CI compliance with ADR-0046 via static analysis, lint rules, or pipeline gates covering: must, layer, enforce. Concrete checks to be wired into the harness.",
      "blocking": true,
      "enforcement": "executable"
    }
  ],
  "references": [
    "reference/architecture/adrs/nodejs/0046-no-raw-identifiers-in-ui.md"
  ],
  "effectiveDate": "2026-06-07"
}
