{
  "$schema": "../../schema/ruleset-standard.schema.json",
  "$id": "https://evolith.dev/rulesets/adr/generated/adr-0053-integration-and-e2e-testing-strategy.rules.json",
  "title": "ADR-0053 — Integration and E2E Testing Strategy Rules (generated)",
  "description": "Auto-generated ruleset encoding ADR-0053 (core track). Classification: executable. Generated by .harness/scripts/generate-adr-rulesets.mjs — do not edit by hand.",
  "version": "1.0.0",
  "adrId": "ADR-0053",
  "adrTitle": "Integration and E2E Testing Strategy",
  "status": "Approved",
  "date": "2026-05-14",
  "rules": [
    {
      "id": "CORE-0053-01",
      "severity": "MUST",
      "category": "adr-conformance",
      "title": "Conform to ADR-0053: Integration and E2E Testing Strategy",
      "description": "Implementations MUST conform to the decision recorded in ADR-0053 (core track). ADR decision: We establish a mandatory strategy for heavy weight testing layers. Definition: Verifying a single Infrastructure Adapter against its real external counterpart. Mandatory Rule: MUST use Testcontainers to spin up real instances of SQL Server, PostgreSQL, Redis, or MongoDB. This ADR contains enforceable language (must, layer, structure); conformance is expected to be verifiable via static analysis, linting, CI gates, or structural checks.",
      "statement": "ADR decision: We establish a mandatory strategy for heavy weight testing layers. Definition: Verifying a single Infrastructure Adapter against its real external counterpart. Mandatory Rule: MUST use Testcontainers to spin up real instances of SQL Server, PostgreSQL, Redis, or MongoDB.",
      "rationale": "Derived from ADR-0053 \"Decision\" section. Enforcement signals detected: must, layer, structure.",
      "validationQuery": "Verify codebase/CI compliance with ADR-0053 via static analysis, lint rules, or pipeline gates covering: must, layer, structure. Concrete checks to be wired into the harness.",
      "blocking": true,
      "enforcement": "executable"
    }
  ],
  "references": [
    "reference/architecture/adrs/core/0053-integration-e2e-testing-strategy.md"
  ],
  "effectiveDate": "2026-05-14"
}
