{
  "$schema": "../../schema/ruleset-standard.schema.json",
  "$id": "https://evolith.dev/rulesets/adr/generated/adr-nodejs-0029-adoption-of-tactical-ddd-primitives-library.rules.json",
  "title": "ADR-0029 — Adoption of Tactical DDD Primitives Library Rules (generated)",
  "description": "Auto-generated ruleset encoding ADR-0029 (nodejs track). Classification: executable. Generated by .harness/scripts/generate-adr-rulesets.mjs — do not edit by hand.",
  "version": "1.0.0",
  "adrId": "ADR-0029",
  "adrTitle": "Adoption of Tactical DDD Primitives Library",
  "status": "Approved",
  "date": "2026-05-09",
  "rules": [
    {
      "id": "NODE-0029-01",
      "severity": "MUST",
      "category": "adr-conformance",
      "title": "Conform to ADR-0029: Adoption of Tactical DDD Primitives Library",
      "description": "Implementations MUST conform to the decision recorded in ADR-0029 (nodejs track). ADR decision: Standardize on utilizing the @nestjslatam/ddd primitives ecosystem within core domains to accelerate velocity: 1. Pure Typescript Only : Adhering to core purity constraints, this specific package has 0 external NPM dependencies, making it totally safe for placement directly in the Domain innermost layer. This ADR contains enforceable language (dependencies, layer, import); conformance is expected to be verifiable via static analysis, linting, CI gates, or structural checks.",
      "statement": "ADR decision: Standardize on utilizing the @nestjslatam/ddd primitives ecosystem within core domains to accelerate velocity: 1. Pure Typescript Only : Adhering to core purity constraints, this specific package has 0 external NPM dependencies, making it totally safe for placement directly in the Domain innermost layer.",
      "rationale": "Derived from ADR-0029 \"Decision\" section. Enforcement signals detected: dependencies, layer, import.",
      "validationQuery": "Verify codebase/CI compliance with ADR-0029 via static analysis, lint rules, or pipeline gates covering: dependencies, layer, import. Concrete checks to be wired into the harness.",
      "blocking": true,
      "enforcement": "executable"
    }
  ],
  "references": [
    "reference/architecture/adrs/nodejs/0029-tactical-ddd-primitives-library.md"
  ],
  "effectiveDate": "2026-05-09"
}
