{
  "$schema": "../../schema/ruleset-standard.schema.json",
  "$id": "https://evolith.dev/rulesets/adr/generated/adr-0049-naming-semantics-clean-code-policy-e2e-and-global.rules.json",
  "title": "ADR-0049 — Naming Semantics & Clean Code Policy (E2E and Global) Rules (generated)",
  "description": "Auto-generated ruleset encoding ADR-0049 (core track). Classification: executable. Generated by .harness/scripts/generate-adr-rulesets.mjs — do not edit by hand.",
  "version": "1.0.0",
  "adrId": "ADR-0049",
  "adrTitle": "Naming Semantics & Clean Code Policy (E2E and Global)",
  "status": "Accepted",
  "date": "2026-05-13",
  "rules": [
    {
      "id": "CORE-0049-01",
      "severity": "MUST",
      "category": "adr-conformance",
      "title": "Conform to ADR-0049: Naming Semantics & Clean Code Policy (E2E and Global)",
      "description": "Implementations MUST conform to the decision recorded in ADR-0049 (core track). ADR decision: Compliance with Clean Code standards is enforced for all naming and semantics in the E2E development lifecycle. lowerCamelCase : Variables, object instances, functions, and interface members. This ADR contains enforceable language (must, prohibited, naming, enforce, enforced); conformance is expected to be verifiable via static analysis, linting, CI gates, or structural checks.",
      "statement": "ADR decision: Compliance with Clean Code standards is enforced for all naming and semantics in the E2E development lifecycle. lowerCamelCase : Variables, object instances, functions, and interface members.",
      "rationale": "Derived from ADR-0049 \"Decision\" section. Enforcement signals detected: must, prohibited, naming, enforce, enforced.",
      "validationQuery": "Verify codebase/CI compliance with ADR-0049 via static analysis, lint rules, or pipeline gates covering: must, prohibited, naming, enforce, enforced. Concrete checks to be wired into the harness.",
      "blocking": true,
      "enforcement": "executable"
    }
  ],
  "references": [
    "reference/architecture/adrs/core/0049-naming-semantics-clean-code-policy.md"
  ],
  "effectiveDate": "2026-05-13"
}
