{
  "$schema": "../../schema/ruleset-standard.schema.json",
  "$id": "https://evolith.dev/rulesets/adr/generated/adr-dotnet-0064-net-request-scope-observability-context-propagation.rules.json",
  "title": "ADR-0064 — .NET Request-Scope Observability Context Propagation Rules (generated)",
  "description": "Auto-generated ruleset encoding ADR-0064 (dotnet track). Classification: executable. Generated by .harness/scripts/generate-adr-rulesets.mjs — do not edit by hand.",
  "version": "1.0.0",
  "adrId": "ADR-0064",
  "adrTitle": ".NET Request-Scope Observability Context Propagation",
  "status": "Accepted",
  "date": "2026-05-24",
  "rules": [
    {
      "id": "DOT-0064-01",
      "severity": "MUST",
      "category": "adr-conformance",
      "title": "Conform to ADR-0064: .NET Request-Scope Observability Context Propagation",
      "description": "Implementations MUST conform to the decision recorded in ADR-0064 (dotnet track). ADR decision: Introduce a scoped RequestContextAccessor that is written exactly once by the SessionTrackingMiddleware and consumed by any component in the same DI scope through two segregated interfaces. This ADR contains enforceable language (required, dependencies, layer, structure); conformance is expected to be verifiable via static analysis, linting, CI gates, or structural checks.",
      "statement": "ADR decision: Introduce a scoped RequestContextAccessor that is written exactly once by the SessionTrackingMiddleware and consumed by any component in the same DI scope through two segregated interfaces.",
      "rationale": "Derived from ADR-0064 \"Decision\" section. Enforcement signals detected: required, dependencies, layer, structure.",
      "validationQuery": "Verify codebase/CI compliance with ADR-0064 via static analysis, lint rules, or pipeline gates covering: required, dependencies, layer, structure. Concrete checks to be wired into the harness.",
      "blocking": true,
      "enforcement": "executable"
    }
  ],
  "references": [
    "reference/architecture/adrs/dotnet/0064-dotnet-request-scope-observability-context.md"
  ],
  "effectiveDate": "2026-05-24"
}
