{
  "$schema": "../../schema/ruleset-standard.schema.json",
  "$id": "https://evolith.dev/rulesets/adr/generated/adr-0025-feature-flag-provider-abstraction-strategy.rules.json",
  "title": "ADR-0025 — Feature Flag Provider Abstraction Strategy Rules (generated)",
  "description": "Auto-generated ruleset encoding ADR-0025 (core track). Classification: executable. Generated by .harness/scripts/generate-adr-rulesets.mjs — do not edit by hand.",
  "version": "1.0.0",
  "adrId": "ADR-0025",
  "adrTitle": "Feature Flag Provider Abstraction Strategy",
  "status": "Approved",
  "date": "2026-05-09",
  "rules": [
    {
      "id": "CORE-0025-01",
      "severity": "MUST",
      "category": "adr-conformance",
      "title": "Conform to ADR-0025: Feature Flag Provider Abstraction Strategy",
      "description": "Implementations MUST conform to the decision recorded in ADR-0025 (core track). ADR decision: Subsume feature toggle invocation under classic Hexagonal Port principles: 1. Canonical Port : The core repository defines IFeatureFlagPort , detailing universal execution contracts ( evaluate() , isHealthy() ) entirely isolated from commercial library syntax. This ADR contains enforceable language (dependency, layer, structure); conformance is expected to be verifiable via static analysis, linting, CI gates, or structural checks.",
      "statement": "ADR decision: Subsume feature toggle invocation under classic Hexagonal Port principles: 1. Canonical Port : The core repository defines IFeatureFlagPort , detailing universal execution contracts ( evaluate() , isHealthy() ) entirely isolated from commercial library syntax.",
      "rationale": "Derived from ADR-0025 \"Decision\" section. Enforcement signals detected: dependency, layer, structure.",
      "validationQuery": "Verify codebase/CI compliance with ADR-0025 via static analysis, lint rules, or pipeline gates covering: dependency, layer, structure. Concrete checks to be wired into the harness.",
      "blocking": true,
      "enforcement": "executable"
    }
  ],
  "references": [
    "reference/architecture/adrs/core/0025-feature-flag-provider-abstraction.md"
  ],
  "effectiveDate": "2026-05-09"
}
