{
  "$schema": "../../schema/ruleset-standard.schema.json",
  "$id": "https://evolith.dev/rulesets/adr/generated/adr-0011-fault-tolerance-and-resiliency-patterns.rules.json",
  "title": "ADR-0011 — Fault Tolerance and Resiliency Patterns Rules (generated)",
  "description": "Auto-generated ruleset encoding ADR-0011 (core track). Classification: executable. Generated by .harness/scripts/generate-adr-rulesets.mjs — do not edit by hand.",
  "version": "1.0.0",
  "adrId": "ADR-0011",
  "adrTitle": "Fault Tolerance and Resiliency Patterns",
  "status": "Approved",
  "date": "2026-05-08",
  "rules": [
    {
      "id": "CORE-0011-01",
      "severity": "MUST",
      "category": "adr-conformance",
      "title": "Conform to ADR-0011: Fault Tolerance and Resiliency Patterns",
      "description": "Implementations MUST conform to the decision recorded in ADR-0011 (core track). ADR decision: Implement explicit Resilience Patterns protecting all outbound system exits: 1. Distributed Circuit Breaker (Opossum + Redis) : Wrap outbound network calls in high level infrastructure adapters. This ADR contains enforceable language (must, structure); conformance is expected to be verifiable via static analysis, linting, CI gates, or structural checks.",
      "statement": "ADR decision: Implement explicit Resilience Patterns protecting all outbound system exits: 1. Distributed Circuit Breaker (Opossum + Redis) : Wrap outbound network calls in high level infrastructure adapters.",
      "rationale": "Derived from ADR-0011 \"Decision\" section. Enforcement signals detected: must, structure.",
      "validationQuery": "Verify codebase/CI compliance with ADR-0011 via static analysis, lint rules, or pipeline gates covering: must, structure. Concrete checks to be wired into the harness.",
      "blocking": true,
      "enforcement": "executable"
    }
  ],
  "references": [
    "reference/architecture/adrs/core/0011-fault-tolerance-resiliency-patterns.md"
  ],
  "effectiveDate": "2026-05-08"
}
