{
  "$schema": "../schema/ruleset-standard.schema.json",
  "$id": "https://evolith.dev/rulesets/cross-cutting/repository-taxonomy.rules.json",
  "title": "Repository Taxonomy Rules",
  "description": "Machine-readable encoding of the Evolith Repository Taxonomy. Naming, structure, and artifact classification rules for all Evolith repositories.",
  "version": "1.0.0",
  "effectiveDate": "2026-01-01",
  "rules": [
    {
      "id": "TAX-01",
      "severity": "MUST",
      "category": "naming-conventions",
      "title": "File names use kebab-case",
      "description": "All file names use kebab-case (lowercase with hyphens). No spaces, no underscores in file names. Example: my-file-name.md, user-service.ts.",
      "validationQuery": "File names validated via linting or CI script. Pattern: ^[a-z0-9-]+\\.[a-z]+$",
      "blocking": true,
      "examples": [
        "my-file.md",
        "user-service.ts",
        "api-gateway.ts"
      ]
    },
    {
      "id": "TAX-02",
      "severity": "MUST",
      "category": "naming-conventions",
      "title": "Class and type names use PascalCase",
      "description": "Classes, interfaces, types, enums, and UI components use PascalCase.",
      "rationale": "ADR-0056: Ubiquitous language enforcement. PascalCase for types/components.",
      "validationQuery": "ESLint naming-convention for classes and interfaces.",
      "blocking": true,
      "examples": [
        "UserService",
        "HttpClient",
        "ApiResponse"
      ]
    },
    {
      "id": "TAX-03",
      "severity": "MUST",
      "category": "naming-conventions",
      "title": "Variable and function names use camelCase",
      "description": "Variables, functions, methods use camelCase.",
      "rationale": "ADR-0056: camelCase for variables and functions.",
      "validationQuery": "ESLint naming-convention for variables and functions.",
      "blocking": true,
      "examples": [
        "getUserById",
        "userData",
        "isValid"
      ]
    },
    {
      "id": "TAX-04",
      "severity": "MUST",
      "category": "naming-conventions",
      "title": "Constants use UPPER_SNAKE_CASE",
      "description": "Compile-time constants and configuration keys use UPPER_SNAKE_CASE.",
      "validationQuery": "ESLint naming-convention for constants.",
      "blocking": false,
      "examples": [
        "MAX_RETRY_COUNT",
        "API_BASE_URL"
      ]
    },
    {
      "id": "TAX-05",
      "severity": "MUST",
      "category": "directory-structure",
      "title": "Evolith Core structure: reference/, sdk/, rulesets/",
      "description": "Evolith Core repository uses three primary directories: reference/ (human-authored standards), sdk/ (CLI tooling), rulesets/ (machine-readable rules). No other top-level content directories.",
      "rationale": "Repository Taxonomy defines three entry points with clear ownership.",
      "validationQuery": "Top-level directories match taxonomy. No arbitrary content directories added.",
      "blocking": true,
      "structure": [
        "reference/",
        "sdk/",
        "rulesets/"
      ]
    },
    {
      "id": "TAX-06",
      "severity": "MUST",
      "category": "directory-structure",
      "title": "Satellite structure: src/, tests/, docs/",
      "description": "Satellite repositories follow standard structure: src/ (source code), tests/ (test code), docs/ (documentation). Infrastructure code lives under src/Infrastructure, domain code under src/Domain.",
      "rationale": "Repository Taxonomy standard satellite structure.",
      "validationQuery": "Satellite root has src/, tests/, docs/ directories. Hexagonal layers under src/.",
      "blocking": true,
      "structure": [
        "src/Domain",
        "src/Application",
        "src/Infrastructure",
        "src/Api"
      ]
    },
    {
      "id": "TAX-07",
      "severity": "MUST",
      "category": "adr-naming",
      "title": "ADR files named with zero-padded ID",
      "description": "ADR files use format: NNNN-descriptive-name.md where NNNN is zero-padded 4-digit number. Example: 0002-clean-architecture-nestjs.md, 0069-dotnet-grpc-service.md.",
      "rationale": "ADR-0048: Canonical numbering enables sorting and referencing.",
      "validationQuery": "ADR filenames match pattern: ^[0-9]{4}-[a-z-]+\\.md$",
      "blocking": true,
      "examples": [
        "0002-clean-architecture-nestjs.md",
        "0069-dotnet-grpc-service-setup-protobuf-contracts.md"
      ]
    },
    {
      "id": "TAX-08",
      "severity": "MUST",
      "category": "adr-naming",
      "title": "Bilingual ADR files use .es.md suffix",
      "description": "Spanish translations of ADRs use .es.md suffix in same directory. Example: 0002-clean-architecture-nestjs.es.md alongside 0002-clean-architecture-nestjs.md.",
      "rationale": "Bilingual naming convention: Pattern A for individual files.",
      "validationQuery": "Bilingual parity: every .md ADR has corresponding .es.md in same directory.",
      "blocking": true
    },
    {
      "id": "TAX-09",
      "severity": "MUST",
      "category": "artifact-classification",
      "title": "Evolith reference artifacts in reference/",
      "description": "Reusable policy, decision criteria, and accepted trade-offs go in reference/architecture/, reference/governance/, reference/knowledge/. These are normative or decisional depending on document status.",
      "rationale": "Repository Taxonomy: Canonical Reference goes in reference/.",
      "validationQuery": "Architecture decisions, standards, and patterns placed in correct reference/ subdirectory.",
      "blocking": true
    },
    {
      "id": "TAX-10",
      "severity": "MUST",
      "category": "artifact-classification",
      "title": "Product-specific evidence not in reference/",
      "description": "Product-specific routes, schemas, seeds, and branding do NOT go in reference/. They go in the satellite repository. Enterprise policy changes go through Evolith governance.",
      "rationale": "Repository Taxonomy: Product evidence stays in product repo, not reference.",
      "validationQuery": "No product-specific files in reference/. Product evidence in satellite repositories.",
      "blocking": true
    }
  ],
  "references": [
    "reference/governance/standards/repository-taxonomy.md",
    "reference/architecture/adrs/core/0048-enterprise-taxonomy-reference-layout.md",
    "reference/architecture/adrs/core/0056-enterprise-naming-design-conventions.md"
  ],
  "exitCriteria": {
    "description": "All files follow naming conventions. Directory structure matches taxonomy. ADR files correctly numbered.",
    "validationTools": [
      "CI naming validation",
      "directory structure check",
      "ADR numbering validation"
    ]
  }
}
