{
  "$schema": "../../../../../rulesets/schema/ruleset-standard.schema.json",
  "$id": "https://evolith.dev/rulesets/topologies/edge-computing.rules.json",
  "title": "Edge Computing Topology Rules",
  "description": "Architectural rules for the Edge Computing topology.",
  "version": "1.0.0",
  "effectiveDate": "2026-06-20",
  "rules": [
    {
      "id": "EC-SEC-01",
      "severity": "MUST",
      "category": "execution-security",
      "title": "Network Security Profile",
      "description": "Edge computing components MUST define a 'networkSecurity' profile in their config.",
      "blocking": true
    },
    {
      "id": "EC-SEC-02",
      "severity": "MUST",
      "category": "execution-mtls",
      "title": "mTLS Enforcement",
      "description": "mTLS must be enabled for all edge computing network communications.",
      "blocking": true
    },
    {
      "id": "EC-R01",
      "severity": "MUST",
      "category": "edge-computing-sync",
      "title": "Mandatory Synchronization Strategy",
      "description": "An Edge Computing satellite MUST provide edge-computing.config.json and declare syncStrategy (offline-first, eventual, or real-time-fallback).",
      "blocking": true
    },
    {
      "id": "EC-R02",
      "severity": "MUST",
      "category": "edge-computing-isolation",
      "title": "Edge Node Isolation",
      "description": "edge-computing.config.json MUST declare edgeIsolation=true.",
      "blocking": true
    },
    {
      "id": "EC-R03",
      "severity": "MUST",
      "category": "edge-computing-conflict",
      "title": "Conflict Resolution Strategy",
      "description": "edge-computing.config.json MUST declare conflictResolution (last-write-wins, merge, or manual).",
      "blocking": true
    }
  ]
}
