{
  "$schema": "../../schema/ruleset-standard.schema.json",
  "$id": "https://evolith.dev/rulesets/adr/generated/adr-0073-unified-cli-mcp-output-contract-and-gate-evidence-schema.rules.json",
  "title": "ADR-0073 — Unified CLI/MCP Output Contract and Gate Evidence Schema Rules (generated)",
  "description": "Auto-generated ruleset encoding ADR-0073 (core track). Classification: executable. Generated by .harness/scripts/generate-adr-rulesets.mjs — do not edit by hand.",
  "version": "1.0.0",
  "adrId": "ADR-0073",
  "adrTitle": "Unified CLI/MCP Output Contract and Gate Evidence Schema",
  "status": "Approved — Evolith Architecture Board, 2026-06-10. Closes [GT-01](../../../governance/standards/vision/gap-reference-catalog.md#gt-01).",
  "date": "2026-06-10",
  "rules": [
    {
      "id": "CORE-0073-01",
      "severity": "MUST",
      "category": "adr-conformance",
      "title": "Conform to ADR-0073: Unified CLI/MCP Output Contract and Gate Evidence Schema",
      "description": "Implementations MUST conform to the decision recorded in ADR-0073 (core track). ADR decision: Adopt option 3 . This ADR contains enforceable language (must, prohibited, layer, naming); conformance is expected to be verifiable via static analysis, linting, CI gates, or structural checks.",
      "statement": "ADR decision: Adopt option 3 .",
      "rationale": "Derived from ADR-0073 \"Decision\" section. Enforcement signals detected: must, prohibited, layer, naming.",
      "validationQuery": "Verify codebase/CI compliance with ADR-0073 via static analysis, lint rules, or pipeline gates covering: must, prohibited, layer, naming. Concrete checks to be wired into the harness.",
      "blocking": true,
      "enforcement": "executable"
    }
  ],
  "references": [
    "reference/architecture/adrs/core/0073-unified-cli-output-contract.md"
  ],
  "effectiveDate": "2026-06-10"
}
