{
  "$schema": "../../schema/ruleset-standard.schema.json",
  "$id": "https://evolith.dev/rulesets/adr/generated/adr-0035-distributed-saga-pattern-implementation-strategy.rules.json",
  "title": "ADR-0035 — Distributed Saga Pattern Implementation Strategy Rules (generated)",
  "description": "Auto-generated ruleset encoding ADR-0035 (core track). Classification: executable. Generated by .harness/scripts/generate-adr-rulesets.mjs — do not edit by hand.",
  "version": "1.0.0",
  "adrId": "ADR-0035",
  "adrTitle": "Distributed Saga Pattern Implementation Strategy",
  "status": "Approved",
  "date": "2026-05-11",
  "rules": [
    {
      "id": "CORE-0035-01",
      "severity": "MUST",
      "category": "adr-conformance",
      "title": "Conform to ADR-0035: Distributed Saga Pattern Implementation Strategy",
      "description": "Implementations MUST conform to the decision recorded in ADR-0035 (core track). ADR decision: Adopt the following corporate matrix to define the implementation strategy for long running or multi service transactions: Before deploying a Saga, verify if the business process can be contained within a Single Bounded Context . This ADR contains enforceable language (must, required); conformance is expected to be verifiable via static analysis, linting, CI gates, or structural checks.",
      "statement": "ADR decision: Adopt the following corporate matrix to define the implementation strategy for long running or multi service transactions: Before deploying a Saga, verify if the business process can be contained within a Single Bounded Context .",
      "rationale": "Derived from ADR-0035 \"Decision\" section. Enforcement signals detected: must, required.",
      "validationQuery": "Verify codebase/CI compliance with ADR-0035 via static analysis, lint rules, or pipeline gates covering: must, required. Concrete checks to be wired into the harness.",
      "blocking": true,
      "enforcement": "executable"
    }
  ],
  "references": [
    "reference/architecture/adrs/core/0035-distributed-saga-pattern-strategy.md"
  ],
  "effectiveDate": "2026-05-11"
}
