{
  "$schema": "../../schema/ruleset-standard.schema.json",
  "$id": "https://evolith.dev/rulesets/adr/generated/adr-0048-enterprise-taxonomy-standardization-and-reference-layout.rules.json",
  "title": "ADR-0048 — Enterprise Taxonomy Standardization and Reference Layout Rules (generated)",
  "description": "Auto-generated ruleset encoding ADR-0048 (core track). Classification: executable. Generated by .harness/scripts/generate-adr-rulesets.mjs — do not edit by hand.",
  "version": "1.0.0",
  "adrId": "ADR-0048",
  "adrTitle": "Enterprise Taxonomy Standardization and Reference Layout",
  "status": "Accepted",
  "date": "",
  "rules": [
    {
      "id": "CORE-0048-01",
      "severity": "MUST",
      "category": "adr-conformance",
      "title": "Conform to ADR-0048: Enterprise Taxonomy Standardization and Reference Layout",
      "description": "Implementations MUST conform to the decision recorded in ADR-0048 (core track). ADR decision: It has been decided to adopt and enforce the Enterprise Taxonomy and Repository Structuring Policy as a global, immutable, and inheritable standard for this repository and all satellite ecosystems. This ADR contains enforceable language (must, naming, structure, enforce); conformance is expected to be verifiable via static analysis, linting, CI gates, or structural checks.",
      "statement": "ADR decision: It has been decided to adopt and enforce the Enterprise Taxonomy and Repository Structuring Policy as a global, immutable, and inheritable standard for this repository and all satellite ecosystems.",
      "rationale": "Derived from ADR-0048 \"Decision\" section. Enforcement signals detected: must, naming, structure, enforce.",
      "validationQuery": "Verify codebase/CI compliance with ADR-0048 via static analysis, lint rules, or pipeline gates covering: must, naming, structure, enforce. Concrete checks to be wired into the harness.",
      "blocking": true,
      "enforcement": "executable"
    }
  ],
  "references": [
    "reference/architecture/adrs/core/0048-enterprise-taxonomy-reference-layout.md"
  ]
}
