{
  "$schema": "../../schema/ruleset-standard.schema.json",
  "$id": "https://evolith.dev/rulesets/adr/generated/adr-0098-rest-uri-versioning-and-deprecation-policy.rules.json",
  "title": "ADR-0098 — REST URI Versioning and Deprecation Policy Rules (generated)",
  "description": "Auto-generated ruleset encoding ADR-0098 (core track). Classification: executable. Generated by .harness/scripts/generate-adr-rulesets.mjs — do not edit by hand.",
  "version": "1.0.0",
  "adrId": "ADR-0098",
  "adrTitle": "REST URI Versioning and Deprecation Policy",
  "status": "Accepted",
  "date": "2026-06-21",
  "rules": [
    {
      "id": "CORE-0098-01",
      "severity": "MUST",
      "category": "adr-conformance",
      "title": "Conform to ADR-0098: REST URI Versioning and Deprecation Policy",
      "description": "Implementations MUST conform to the decision recorded in ADR-0098 (core track). ADR decision: Adopt URI versioning as the canonical REST versioning strategy and publish a deprecation policy enforced by CI and visible to callers in response headers. Every REST route is served under /api/v<MAJOR /... This ADR contains enforceable language (required, lint, enforce, enforced); conformance is expected to be verifiable via static analysis, linting, CI gates, or structural checks.",
      "statement": "ADR decision: Adopt URI versioning as the canonical REST versioning strategy and publish a deprecation policy enforced by CI and visible to callers in response headers. Every REST route is served under /api/v<MAJOR /...",
      "rationale": "Derived from ADR-0098 \"Decision\" section. Enforcement signals detected: required, lint, enforce, enforced.",
      "validationQuery": "Verify codebase/CI compliance with ADR-0098 via static analysis, lint rules, or pipeline gates covering: required, lint, enforce, enforced. Concrete checks to be wired into the harness.",
      "blocking": true,
      "enforcement": "executable"
    }
  ],
  "references": [
    "reference/architecture/adrs/core/0098-rest-uri-versioning-deprecation-policy.md"
  ],
  "effectiveDate": "2026-06-21"
}
