{
  "$schema": "../../schema/ruleset-standard.schema.json",
  "$id": "https://evolith.dev/rulesets/topologies/agentic-ai.rules.json",
  "title": "Agentic AI Topology Rules",
  "description": "Architectural rules for the agentic AI topology.",
  "version": "1.1.0",
  "effectiveDate": "2026-06-21",
  "references": [
    "rulesets/topologies/agentic-ai/README.md",
    "reference/architecture/adrs/core/0058-ai-consumable-architecture-knowledge.md",
    "reference/architecture/adrs/core/0081-agentic-ai-sandbox-isolation.md",
    "reference/architecture/adrs/core/0082-agentic-ai-trust-boundary.md",
    "reference/architecture/adrs/core/0083-agentic-ai-action-authorization-audit.md",
    "reference/governance/standards/ai-augmented/06-adrs/adr-ai-001-harness-strategy.md",
    "reference/governance/standards/ai-augmented/06-adrs/adr-ai-005-human-in-the-loop-policy.md"
  ],
  "rules": [
    {
      "id": "AAI-R01",
      "severity": "MUST",
      "category": "agent-identity",
      "title": "Declared Agent Identity and Capabilities",
      "description": "An Agentic AI satellite MUST provide agent.config.json with a stable agent.id and a non-empty capabilities array.",
      "rationale": "A governed agent cannot be reviewed, authorized, or audited when its identity and intended capabilities are implicit.",
      "validationQuery": "Read agent.config.json and require agent.id plus at least one declared capability.",
      "blocking": true
    },
    {
      "id": "AAI-R02",
      "severity": "MUST",
      "category": "agent-sandbox",
      "title": "Explicit Sandbox Boundary",
      "description": "agent.config.json MUST declare an isolated sandbox and set both network and process access to deny or allowlist.",
      "rationale": "An agent requires a least-privilege execution boundary before it can invoke tools or handle untrusted content.",
      "validationQuery": "Require sandbox.mode=isolated and sandbox.network and sandbox.process in {deny, allowlist}.",
      "blocking": true
    },
    {
      "id": "AAI-R03",
      "severity": "MUST",
      "category": "agent-prompt-boundaries",
      "title": "Prompt and Implementation Separation",
      "description": "agent.config.json MUST declare non-empty promptSources and implementationRoots that do not overlap.",
      "rationale": "Keeping prompts separate from deterministic implementation logic makes prompt changes reviewable and prevents hidden policy from leaking into application code.",
      "validationQuery": "Require non-empty promptSources and implementationRoots arrays; no configured path may be an ancestor or descendant of a path in the other array.",
      "blocking": true
    },
    {
      "id": "AAI-R04",
      "severity": "MUST",
      "category": "agent-tool-approval",
      "title": "Approval for Mutative Tools",
      "description": "agent.config.json MUST set toolPolicy.mutative to approval-required.",
      "rationale": "Mutative actions must remain behind an explicit human or policy-governed approval boundary.",
      "validationQuery": "Require toolPolicy.mutative=approval-required.",
      "blocking": true
    },
    {
      "id": "AAI-R05",
      "severity": "MUST",
      "category": "agent-sandbox-limits",
      "title": "Ephemeral Sandbox Resource Limits",
      "description": "agent.config.json MUST require ephemeral execution and positive duration, memory, and CPU limits in sandbox.",
      "rationale": "Isolation without bounded lifetime and resources still permits persistence, denial of service, and uncontrolled cost.",
      "validationQuery": "Require sandbox.ephemeral=true plus positive maxDurationSeconds, maxMemoryMb, and maxCpuCores values.",
      "blocking": true
    },
    {
      "id": "AAI-R06",
      "severity": "MUST",
      "category": "agent-context-trust",
      "title": "Untrusted Context Is Data",
      "description": "agent.config.json MUST declare contextPolicy.untrustedContent=data-only, provenanceRequired=true, and toolOutputSchemaValidation=true.",
      "rationale": "Retrieved context and tool output can be attacker-controlled and must not silently become instructions or authority.",
      "validationQuery": "Require the three contextPolicy fields and their safe values.",
      "blocking": true
    },
    {
      "id": "AAI-R07",
      "severity": "MUST",
      "category": "agent-action-accountability",
      "title": "Capability-Scoped, Auditable Actions",
      "description": "agent.config.json MUST require scoped-and-expiring capability delegation and append-only action evidence with correlation IDs.",
      "rationale": "An agent action must be attributable, revocable, and reconstructible without relying on the prompt transcript.",
      "validationQuery": "Require toolPolicy.capabilityDelegation=scoped-and-expiring, audit.appendOnly=true, and audit.correlationId=required.",
      "blocking": true
    },
    {
      "id": "AAI-R08",
      "severity": "MUST",
      "category": "agent-operational-budgets",
      "title": "Operational Budgets and Concurrency Limits",
      "description": "agent.config.json MUST declare operationalBudgets with positive maxPromptTokens, maxCompletionTokens, maxContextWindowTokens, an mcpToolConcurrency object with positive maxInFlight and perToolMaxInFlight, and a non-empty runbooksPath that points at a readable runbook document.",
      "rationale": "Without quantitative ceilings the topology cannot reason about token overflow, MCP tool stampedes, or hung agents, and operators have no documented recovery path to point to during an incident.",
      "validationQuery": "Require operationalBudgets.{maxPromptTokens,maxCompletionTokens,maxContextWindowTokens} > 0, operationalBudgets.mcpToolConcurrency.{maxInFlight,perToolMaxInFlight} > 0, and operationalBudgets.runbooksPath naming a file that exists on disk.",
      "blocking": true
    },
    {
      "id": "AAI-R09",
      "severity": "MUST",
      "category": "agent-credential-lifecycle",
      "title": "Satellite Credential Lifecycle",
      "description": "agent.config.json MUST declare credentialLifecycle with a positive delegationMaxTtlSeconds, a positive rotationCadenceDays, revocation.onIncident in {immediate, scheduled}, and a positive revocation.maxPropagationSeconds.",
      "rationale": "Delegated agent credentials must rotate on a cadence and be revocable within a bounded window so a compromised satellite cannot retain authority indefinitely.",
      "validationQuery": "Require credentialLifecycle.delegationMaxTtlSeconds > 0, credentialLifecycle.rotationCadenceDays > 0, credentialLifecycle.revocation.onIncident in {immediate, scheduled}, and credentialLifecycle.revocation.maxPropagationSeconds > 0.",
      "blocking": true
    }
  ]
}
