{
  "$schema": "../../schema/ruleset-standard.schema.json",
  "$id": "https://evolith.dev/rulesets/adr/generated/adr-0041-dual-engine-policy-evaluation-native-opa.rules.json",
  "title": "ADR-0041 — Dual-Engine Policy Evaluation (Native + OPA) Rules (generated)",
  "description": "Auto-generated ruleset encoding ADR-0041 (core track). Classification: executable. Generated by .harness/scripts/generate-adr-rulesets.mjs — do not edit by hand.",
  "version": "1.0.0",
  "adrId": "ADR-0041",
  "adrTitle": "Dual-Engine Policy Evaluation (Native + OPA)",
  "status": "Accepted",
  "date": "",
  "rules": [
    {
      "id": "CORE-0041-01",
      "severity": "MUST",
      "category": "adr-conformance",
      "title": "Conform to ADR-0041: Dual-Engine Policy Evaluation (Native + OPA)",
      "description": "Implementations MUST conform to the decision recorded in ADR-0041 (core track). ADR decision: We will implement a Dual Engine Policy Evaluation Strategy using a Strategy Pattern ( IRuleEvaluatorStrategy ). 1. Native Engine (TypeScript) : Maintains the existing custom logic for baseline rules. This ADR contains enforceable language (must, dependencies, ci/cd); conformance is expected to be verifiable via static analysis, linting, CI gates, or structural checks.",
      "statement": "ADR decision: We will implement a Dual Engine Policy Evaluation Strategy using a Strategy Pattern ( IRuleEvaluatorStrategy ). 1. Native Engine (TypeScript) : Maintains the existing custom logic for baseline rules.",
      "rationale": "Derived from ADR-0041 \"Decision\" section. Enforcement signals detected: must, dependencies, ci/cd.",
      "validationQuery": "Verify codebase/CI compliance with ADR-0041 via static analysis, lint rules, or pipeline gates covering: must, dependencies, ci/cd. Concrete checks to be wired into the harness.",
      "blocking": true,
      "enforcement": "executable"
    }
  ],
  "references": [
    "reference/architecture/adrs/core/0041-dual-engine-policy-evaluation.md"
  ]
}
