{
  "$schema": "../../schema/ruleset-standard.schema.json",
  "$id": "https://evolith.dev/rulesets/adr/generated/adr-nodejs-0022-contextual-authentication-and-pluggable-output-projections.rules.json",
  "title": "ADR-0022 — Contextual Authentication and Pluggable Output Projections Rules (generated)",
  "description": "Auto-generated ruleset encoding ADR-0022 (nodejs track). Classification: advisory. Generated by .harness/scripts/generate-adr-rulesets.mjs — do not edit by hand.",
  "version": "1.0.0",
  "adrId": "ADR-0022",
  "adrTitle": "Contextual Authentication and Pluggable Output Projections",
  "status": "Approved",
  "date": "2026-05-08",
  "rules": [
    {
      "id": "NODE-0022-01",
      "severity": "SHOULD",
      "category": "adr-conformance",
      "title": "Honor design decision in ADR-0022: Contextual Authentication and Pluggable Output Projections",
      "description": "Design and implementation SHOULD honor the decision recorded in ADR-0022 (nodejs track). ADR decision: Separate Identity Validation logic entirely from output composition capabilities, enforcing specialized runtime projectors: 1. Pluggable Projector Map : The Core service emits a universal permission model. Manual attestation required — not machine-verifiable.",
      "statement": "ADR decision: Separate Identity Validation logic entirely from output composition capabilities, enforcing specialized runtime projectors: 1. Pluggable Projector Map : The Core service emits a universal permission model.",
      "rationale": "Derived from ADR-0022 \"Decision\" section. No machine-verifiable signals detected; treated as an advisory design decision.",
      "blocking": false,
      "enforcement": "advisory"
    }
  ],
  "references": [
    "reference/architecture/adrs/nodejs/0022-contextual-auth-and-pluggable-projections.md"
  ],
  "effectiveDate": "2026-05-08"
}
